{"aad_b64":"eyJkZWxpdmVyeV9pZCI6ImI3NjljMDkyLTBkMzUtNGQwNS1iM2IxLTI0ZjczMjZlNDNiMiIsImV2ZW50X2lkIjoiYzBiM2VjMjItMmJjZS00MjkxLWE2NTQtNWI4YzIxNjYzMDQ1Iiwia2V5X2Vwb2NoIjowLCJwb2xpY3lfdmVyc2lvbiI6MSwicmVjaXBpZW50X3dhbGxldCI6IjB4MjIyMjIyMjIyMjIyMjIyMjIyMjIyMjIyMjIyMjIyMjIyMjIyMjIyMiIsInJlc291cmNlX2lkIjoiMHhhYWFhYWFhYWFhYWFhYWFhYWFhYWFhYWFhYWFhYWFhYWFhYWFhYWFhYWFhYWFhYWFhYWFhYWFhYWFhYWFhYWFhIiwic2NoZW1hX3ZlcnNpb24iOjF9","ciphertext_b64":"Z29sZGVuLWNpcGhlcnRleHQtcGxhY2Vob2xkZXI=","delivery_id":"b769c092-0d35-4d05-b3b1-24f7326e43b2","ephemeral_public_key_b64":"AAECAwQFBgcICQoLDA0ODxAREhMUFRYXGBkaGxwdHh8=","key_epoch":0,"nonce_b64":"AAECAwQFBgcICQoL","policy_version":1,"recipient_wallet":"0x2222222222222222222222222222222222222222","resource_id":"0xaaaaaaaaaaaaaaaaaaaaaaaaaaaaaaaaaaaaaaaaaaaaaaaaaaaaaaaaaaaaaaaa","schema_version":1}